{
  "content_sha256": "e7ddb31db66a880db810ef62f686935ce023ed3adcd2a3a45847c6f37023fe29",
  "data": {
    "plan_id": "rw3:research-round-plan:2464a680598aed2dfebac75be512c0029c5199b09e4ae66e8879591da1eea396",
    "request_key": "321586d83c925eb8d962dae35a9b7f98e89e11e12d5171523d0ec5f381c3bc8e",
    "sequence": 1,
    "session": {
      "id": "rw3:research-session:fb65b5ce98f9412ab1a9b979e2862d5b59cef7e11fdf3e4578f068e7d69e7829",
      "sha256": "06073ac57b0cc384becf6d1578e0937b1c78faaaaf29a6b3c0fcb18d3af49b7e"
    },
    "slot": 0,
    "spec": {
      "continuation": null,
      "cursor": null,
      "depth": 0,
      "lens": "method",
      "neighbor_ids": null,
      "operation": "topic",
      "per_page": 5,
      "provider": "openalex-rest-normalized-v1",
      "query": "Synthetic video diffusion evidence Video diffusion method video diffusion diffusion",
      "request_key": "321586d83c925eb8d962dae35a9b7f98e89e11e12d5171523d0ec5f381c3bc8e",
      "retry": null,
      "seed_key": "seed",
      "subject_ids": [
        {
          "namespace": "arxiv",
          "value": "2401.12345",
          "version": null
        }
      ],
      "subject_origin": null
    },
    "target": {
      "kind": "http_get",
      "url": "https://api.openalex.org/works?search=Synthetic%20video%20diffusion%20evidence%20Video%20diffusion%20method%20video%20diffusion%20diffusion&per_page=5&select=id%2Cids%2Ctitle%2Cpublication_date%2Ccited_by_count%2Cauthorships%2Clocations%2Creferenced_works%2Crelated_works&sort=relevance_score%3Adesc"
    }
  },
  "id": "rw3:discovery-request:e7ddb31db66a880db810ef62f686935ce023ed3adcd2a3a45847c6f37023fe29",
  "kind": "discovery-request",
  "schema_version": "video-paper-wiki-research.discovery-request.v1"
}
